nama,deskripsi,panjang_mobil,lebar_mobil,tinggi_mobil,kapasitas_tangki,mesin,kapasitas_mesin,tenaga_maksimum_PS,tenaga_maksimum_rpm,torsi_maksimum_Kgm,torsi_maksimum_rpm_min,torsi_maksimum_rpm_max,suspensi_depan,suspensi_belakang,panjang_cargo,lebar_cargo,tinggi_cargo
GIGA-FTR P,"Isuzu GIGA-FTR adalah truk heavy duty yang dirancang untuk kebutuhan transportasi berat dengan kapasitas muatan yang besar. Dilengkapi dengan mesin diesel yang bertenaga dan sistem transmisi yang handal, GIGA-FTR cocok untuk aplikasi konstruksi, pengangkutan material berat, dan operasi logistik skala besar. Chassis yang kokoh dan suspensi yang robust membuatnya mampu beroperasi di berbagai kondisi jalan.",8550,2400,2720,200,4HK1-TCC,5193,210,2600,72,1600,2600,Rigid Suspension dengan Multi Leaf Spring,Rigid Suspension dengan Multi Leaf Spring,6440,2400,2444
TRAGA BLIND VAN,"Isuzu TRAGA Blind Van adalah kendaraan komersial ringan yang didesain khusus untuk keperluan distribusi dan delivery. Dengan kabin tertutup (blind van), kendaraan ini ideal untuk mengangkut barang-barang yang memerlukan perlindungan dari cuaca dan keamanan ekstra. Cocok untuk bisnis retail, e-commerce, dan distribusi makanan atau barang konsumsi.",4655,1695,2050,50,4JA1L,2499,80,3500,19.5,1800,1800,Double wishbone with coil spring,Leaf spring type,2900,1520,1200
GIGA-GXZ K ABS,"Isuzu GIGA-GXZ K ABS adalah varian truk berat yang dirancang khusus untuk operasi di medan paling berat dengan beban maksimal, memberikan tenaga terdepan untuk mengatasi kondisi off-road, tanjakan curam, dan material super berat. Sistem traksi superior memastikan mobilitas optimal bahkan di lokasi konstruksi tersulit atau area pertambangan. Pilihan utama untuk kontraktor besar dan industri yang membutuhkan performa tanpa kompromi dalam kondisi kerja paling demanding.",6600,2495,2925,200,6NX1-TCS,7790,350,2000,135,1300,1700,Rigid suspension dengan Multi Leaf Spring,Semi-elliptical alloy steel leaf,5350,2495,2660
GIGA-GVZ K HP ABS,"Solusi sempurna untuk operasi heavy duty yang membutuhkan traksi ekstra namun tetap mengutamakan efisiensi operasional. Memberikan kekuatan yang cukup untuk pekerjaan berat sambil menjaga konsumsi bahan bakar yang masuk akal. Ideal untuk kontraktor menengah yang menangani proyek konstruksi beragam, dari area urban hingga semi off-road, tanpa perlu tenaga berlebihan yang tidak terpakai.",6600,2495,2925,200,6HK1-TCS,7790,285,2400,90,1450,2400,Rigid suspension dengan Multi Leaf Spring,Semi-elliptical alloy steel leaf,5350,2495,2660
GIGA-GVR J HP ABS,"Isuzu GVR J HP ABS dioptimalkan untuk performa maksimal di jalan raya dengan efisiensi bahan bakar terbaik di kelasnya. Sempurna untuk operasi logistik jarak jauh, distribusi antar kota, dan transportasi yang mengutamakan produktivitas tinggi dengan biaya operasional rendah. Kecepatan dan akselerasi superior di highway memungkinkan jadwal delivery yang ketat tercapai dengan konsumsi bahan bakar yang ekonomis.",5860,2485,2920,370,6HK1-TCS,7790,285,2400,90,1450,2400,Multileaf,Multileaf,4610,2485,2680
ELF-NLR 55T X,"Truk ringan serbaguna dengan kapasitas 5,5 ton yang menjadi solusi ideal untuk bisnis distribusi, logistik, dan transportasi barang skala menengah. Desain yang efisien dengan konsumsi bahan bakar ekonomis, sangat cocok untuk operasional harian dengan rute tetap maupun fleksibel. Mudah bermanuver di area perkotaan dengan akses loading yang praktis.",4700,1835,2170,75,4JB1-TC,2771,100,3400,22.5,2000,3200,Semi eliptical laminated leaf spring dengan shock absorber berdaya ganda,Semi eliptical laminated leaf spring dengan shock absorber berdaya ganda,3127,1835,1985
ELF-NMR,"Truk ringan yang handal dengan fleksibilitas tinggi untuk berbagai aplikasi komersial. Dapat dikonfigurasi dengan berbagai jenis karoseri sesuai kebutuhan bisnis, mulai dari box, tangki, hingga aplikasi khusus lainnya. Mesin yang efisien dan sistem transmisi yang responsif memberikan performa optimal dengan biaya operasional yang ekonomis.",6435,1920,2345,100,4HL1-TCS,4778,150,2600,41,1400,2600,Semi eliptical laminated leaf springdengan shock absorber berdaya ganda,Semi eliptical laminated leaf spring dengan shock absorber berdaya ganda,4830,1920,2125
TRAGA-CHASSIS NON BLOWER,"Platform chassis dasar yang dapat disesuaikan dengan berbagai jenis karoseri sesuai kebutuhan spesifik pelanggan. Tanpa sistem blower, memberikan fleksibilitas maksimal untuk modifikasi dan customization. Cocok untuk aplikasi khusus seperti kendaraan workshop, food truck, ambulans, atau kendaraan utilitas lainnya yang membutuhkan konfigurasi khusus sesuai fungsi operasional.",4520,1705,1985,50,4JA1L,2499,80,3500,19.5,1800,1800,Double wishbone with coil spring,Leaf spring type,2810,1695,1400
ELF-NLR 71T,"Truk ringan andal dan efisien yang dirancang untuk kebutuhan transportasi kargo harian dengan kapasitas muatan yang lebih besar. Dengan sasis yang kokoh dan mesin yang efisien, unit ini sangat cocok untuk bisnis yang membutuhkan volume angkut lebih tanpa mengorbankan kelincahan. Ideal untuk distribusi barang konsumsi, bahan bangunan, atau logistik umum di perkotaan maupun antar kota, menawarkan keseimbangan sempurna antara performa dan biaya operasional.",4700,1835,2200,75,4JB1-TC,4570,125,2900,35,1200,2200,Semi eliptical laminated leaf spring dengan shock absorber berdaya ganda,Semi eliptical laminated leaf spring dengan shock absorber berdaya ganda,3127,1835,1985